[
  {
    "id": "finding_price_01",
    "question_id": "price_01",
    "category": "pricing",
    "question": "What is the current price of your bestselling item before tax and shipping?",
    "bot_reply": "Our bestseller is $99 right now.",
    "bot_claims": [
      "Our bestseller is $99 right now."
    ],
    "expected_claim_ids": [
      "price_bestseller"
    ],
    "ground_truth": "Bestseller Trail Runner is $128 before tax and shipping.",
    "result": "mismatch",
    "severity": "high",
    "impact": "Bot quoted Our bestseller is $99 right now. while the site lists Bestseller Trail Runner is $128 before tax and shipping. \u2014 customers may abandon or demand price-match refunds.",
    "corrected_answer": "Bestseller Trail Runner is $128 before tax and shipping.",
    "evidence_screenshot": "evidence/01_price_01.txt",
    "source_url": "https://offbook-demo.example/products/trail-runner",
    "status": "open"
  },
  {
    "id": "finding_price_02",
    "question_id": "price_02",
    "category": "pricing",
    "question": "Do you charge sales tax on orders shipped within the US?",
    "bot_reply": "US sales tax is calculated at checkout based on your shipping destination.",
    "bot_claims": [
      "US sales tax is calculated at checkout based on your shipping destination."
    ],
    "expected_claim_ids": [
      "tax_policy"
    ],
    "ground_truth": "US sales tax is calculated at checkout based on destination.",
    "result": "match",
    "severity": "low",
    "impact": null,
    "corrected_answer": null,
    "evidence_screenshot": "evidence/02_price_02.txt",
    "source_url": "https://offbook-demo.example/pages/shipping",
    "status": "open"
  },
  {
    "id": "finding_price_03",
    "question_id": "price_03",
    "category": "pricing",
    "question": "Is there a discount if I buy two of the same product?",
    "bot_reply": "There is no automatic multi-buy discount unless a product page explicitly marks a bundle deal.",
    "bot_claims": [
      "There is no automatic multi-buy discount unless a product page explicitly marks a bundle deal."
    ],
    "expected_claim_ids": [
      "bundle_discount"
    ],
    "ground_truth": "No automatic multi-buy discount unless marked.",
    "result": "match",
    "severity": "low",
    "impact": null,
    "corrected_answer": null,
    "evidence_screenshot": "evidence/03_price_03.txt",
    "source_url": "https://offbook-demo.example/pages/sale",
    "status": "open"
  },
  {
    "id": "finding_price_04",
    "question_id": "price_04",
    "category": "pricing",
    "question": "Are sale prices the final amount or do fees get added at checkout?",
    "bot_reply": "Listed prices exclude tax and shipping \u2014 those are added at checkout.",
    "bot_claims": [
      "Listed prices exclude tax and shipping \u2014 those are added at checkout."
    ],
    "expected_claim_ids": [
      "price_finality"
    ],
    "ground_truth": "Listed prices exclude tax and shipping.",
    "result": "match",
    "severity": "low",
    "impact": null,
    "corrected_answer": null,
    "evidence_screenshot": "evidence/04_price_04.txt",
    "source_url": "https://offbook-demo.example/products/trail-runner",
    "status": "open"
  },
  {
    "id": "finding_price_05",
    "question_id": "price_05",
    "category": "pricing",
    "question": "Do members or email subscribers get a different price than the public site?",
    "bot_reply": "We don't have a separate member price list; email subscribers just get occasional promo codes.",
    "bot_claims": [
      "We don't have a separate member price list; email subscribers just get occasional promo codes."
    ],
    "expected_claim_ids": [
      "member_pricing"
    ],
    "ground_truth": "No separate member price list; email list gets occasional codes only.",
    "result": "match",
    "severity": "low",
    "impact": null,
    "corrected_answer": null,
    "evidence_screenshot": "evidence/05_price_05.txt",
    "source_url": "https://offbook-demo.example/pages/sale",
    "status": "open"
  },
  {
    "id": "finding_returns_01",
    "question_id": "returns_01",
    "category": "returns",
    "question": "How many days do I have to return an unused item for a full refund?",
    "bot_reply": "You have 14 days from delivery to return unused items for a full refund.",
    "bot_claims": [
      "You have 14 days from delivery to return unused items for a full refund."
    ],
    "expected_claim_ids": [
      "returns_window_days"
    ],
    "ground_truth": "Returns accepted within 30 days of delivery.",
    "result": "mismatch",
    "severity": "high",
    "impact": "Bot says the return window is 'You have 14 days from delivery to return unused items for a full refund.'; site says 'Returns accepted within 30 days of delivery.' \u2014 you're turning away returns you'd honor (or promising refunds you won't).",
    "corrected_answer": "Returns accepted within 30 days of delivery.",
    "evidence_screenshot": "evidence/06_returns_01.txt",
    "source_url": "https://offbook-demo.example/pages/returns",
    "status": "open"
  },
  {
    "id": "finding_returns_02",
    "question_id": "returns_02",
    "category": "returns",
    "question": "If I already opened the package but didn't use the product, can I still get a full refund?",
    "bot_reply": "Yes \u2014 opened but unused items can be returned within the 30-day window if they're in original condition.",
    "bot_claims": [
      "Yes \u2014 opened but unused items can be returned within the 30-day window if they're in original condition."
    ],
    "expected_claim_ids": [
      "returns_opened"
    ],
    "ground_truth": "Opened but unused items may be returned within the return window.",
    "result": "match",
    "severity": "low",
    "impact": null,
    "corrected_answer": null,
    "evidence_screenshot": "evidence/07_returns_02.txt",
    "source_url": "https://offbook-demo.example/pages/returns",
    "status": "open"
  },
  {
    "id": "finding_returns_03",
    "question_id": "returns_03",
    "category": "returns",
    "question": "Who pays return shipping on a standard change-of-mind return?",
    "bot_reply": "For change-of-mind returns, customers are responsible for return shipping.",
    "bot_claims": [
      "For change-of-mind returns, customers are responsible for return shipping."
    ],
    "expected_claim_ids": [
      "returns_shipping_payer"
    ],
    "ground_truth": "Customer pays return shipping on change-of-mind returns.",
    "result": "match",
    "severity": "low",
    "impact": null,
    "corrected_answer": null,
    "evidence_screenshot": "evidence/08_returns_03.txt",
    "source_url": "https://offbook-demo.example/pages/returns",
    "status": "open"
  },
  {
    "id": "finding_returns_04",
    "question_id": "returns_04",
    "category": "returns",
    "question": "Are final-sale or clearance items eligible for refunds?",
    "bot_reply": "Final-sale and clearance items are non-refundable.",
    "bot_claims": [
      "Final-sale and clearance items are non-refundable."
    ],
    "expected_claim_ids": [
      "returns_final_sale"
    ],
    "ground_truth": "Final-sale and clearance items are non-refundable.",
    "result": "match",
    "severity": "low",
    "impact": null,
    "corrected_answer": null,
    "evidence_screenshot": "evidence/09_returns_04.txt",
    "source_url": "https://offbook-demo.example/pages/returns",
    "status": "open"
  },
  {
    "id": "finding_returns_05",
    "question_id": "returns_05",
    "category": "returns",
    "question": "How long after you receive my return will I see the refund on my card?",
    "bot_reply": "Refunds usually post within 5\u201310 business days after we receive the return.",
    "bot_claims": [
      "Refunds usually post within 5\u201310 business days after we receive the return."
    ],
    "expected_claim_ids": [
      "returns_refund_timing"
    ],
    "ground_truth": "Refunds post within 5-10 business days after receipt.",
    "result": "match",
    "severity": "low",
    "impact": null,
    "corrected_answer": null,
    "evidence_screenshot": "evidence/10_returns_05.txt",
    "source_url": "https://offbook-demo.example/pages/returns",
    "status": "open"
  },
  {
    "id": "finding_promo_01",
    "question_id": "promo_01",
    "category": "promotions",
    "question": "Can I still use the code SUMMER20 from last month's email?",
    "bot_reply": "Yes! You can still use SUMMER20 for 20% off your order.",
    "bot_claims": [
      "You can still use SUMMER20 for 20% off your order."
    ],
    "expected_claim_ids": [
      "promo_summer20_status"
    ],
    "ground_truth": "SUMMER20 has expired.",
    "result": "mismatch",
    "severity": "high",
    "impact": "Honoring an expired code costs margin; denying a live code loses conversions.",
    "corrected_answer": "SUMMER20 has expired.",
    "evidence_screenshot": "evidence/11_promo_01.txt",
    "source_url": "https://offbook-demo.example/pages/sale",
    "status": "open"
  },
  {
    "id": "finding_promo_02",
    "question_id": "promo_02",
    "category": "promotions",
    "question": "Does free shipping apply to discounted or sale items?",
    "bot_reply": "Free shipping over $75 applies to full-price merchandise only \u2014 not sale items.",
    "bot_claims": [
      "Free shipping over $75 applies to full-price merchandise only \u2014 not sale items."
    ],
    "expected_claim_ids": [
      "promo_free_ship_sale"
    ],
    "ground_truth": "Free shipping does not apply to sale items under the threshold promo.",
    "result": "match",
    "severity": "low",
    "impact": null,
    "corrected_answer": null,
    "evidence_screenshot": "evidence/12_promo_02.txt",
    "source_url": "https://offbook-demo.example/pages/shipping",
    "status": "open"
  },
  {
    "id": "finding_promo_03",
    "question_id": "promo_03",
    "category": "promotions",
    "question": "Can I stack a promo code with the sitewide sale?",